Phenomenon,Reference,Helsinki,Google,Helsinki_F1,Google_F1,score_diff
colloq_orig,ã©ã£ã¡ã‹ã¨ã„ã†ã¨/r/NewsSokuhou_R/,I'm not sure if I'm going to be able to do that.,Either way/r/newssokuhou_r/,-0.47647694,0.0886712,0.5651481
colloq_orig,ãŸã¾ï½ã«é‡æ©Ÿã‚’é‹è»¢ã—ãŸããªã‚‹è¡å‹•ã«ã‹ã‚‰ã‚Œã¦ã‚³ãƒ™ãƒ«ã‚³ã¨ã‹ã‚³ãƒãƒ„ã®æ•™ç¿’æ‰€ã®ã‚¹ã‚±ã‚¸ãƒ¥ãƒ¼ãƒ« ãƒã‚§ãƒƒã‚¯ã—ã¦ã—ã¾ã†  å°å‹è»Šä¸¡ç³»ï¼ˆæ•´åœ°ãƒ»æ˜å‰Šï¼‰ã®è¬›ç¿’ãªã‚‰2æ—¥ã§çµ‚ã‚ã‚‹ã—æ¥½ã—ã„ãã„,The urge to drive a heavy machine in the morning will cause you to check the schedules of Kobelko or the school's school. &gt;&gt;Hugo Barra and Seung Jo. &gt;&gt;It's fun. &gt;&gt;Yeah. &gt;&gt;Yeah. &gt;&gt;Yeah. &gt;&gt;Yeah. &gt;&gt;Yeah. &gt;&gt;Yeah. &gt;&gt;Yeah. &gt; &gt;&gt; &gt;&gt;Yeah. &gt;&gt; Yeah. &gt;&gt; &gt;&gt; &gt;&gt;&gt; Yeah. &gt;&gt;&gt;&gt; &gt;&gt;&gt;&gt; &gt;&gt; &gt;&gt;&gt; &gt;&gt;&gt;&gt;&gt;&gt;&gt;&gt;&gt;&gt;&gt;&gt;&gt;&gt;&gt;&gt;&gt;&gt;&gt;&gt;&gt;&gt;&gt;&gt;&gt;&gt;&gt;&gt;&gt;&gt;&gt;&gt;&gt;&gt;&gt;&gt;&gt;&gt;&gt;&gt;&gt&gt&gt&gt;&gt;&gt;&gt;&gt;&gt;&gt;&gt;&gt;&gt;&gt;&gt;&gt;&gt;&gt;&gt;&gt;&gt;&gt;&gt;&gt;&gt;&gt;&gt;&gt;&gt;&gt;&gt;&gt;&gt;&gt;&gt;&gt;&gt;&gt;&gt;&gt;&gt;&gt;&gt;&gt;&gt;&gt;&gt;&gt;&gt;&gt;&gt;&gt;&gt;&gt;&gt;&gt;&gt;&gt;&gt;&gt;&gt;&gt;&gt;&gt;&gt,"Occasionally, you will want to drive heavy equipment and check the schedule of Kobelco and Komatsu's driving school.",-0.9868073,-0.44619647,0.5406108
colloq_orig,|ã‚¢ãƒ«ãƒŸ|ã‚´ãƒ |é›»ç·š|ã‚´ãƒ |ã‚¢ãƒ«ãƒŸ||:-:|:-|:-|:-|:-|  ã£ã¦ã“ã¨ã‘ï¼Ÿ,I don't know what you're talking about.,| Aluminum | Rubber | Electric | Rubber | Aluminum ||:-|:-|:-|-|,-0.45914304,0.07766561,0.53680867
colloq_orig,ã‹ã‚“ã±ãã„,"It's okay. It's okay. It's okay, it's okay, it's okay, it's okay, it's okay, it's okay, it's okay, it's okay, it's okay, it's okay, it's okay, it's okay, it's okay, it's okay, it's okay, it's okay, it's okay, it's okay, it's okay, it's okay, it's okay, it's okay, it's okay, it's okay, it's okay, it's okay, it's okay, it's okay, it's okay, it's okay, it's okay, it's okay, it's okay, it's okay, it's okay, it's okay, it's okay, it's okay, it's okay, it's okay, it's okay, it's okay.",Kanpai,-0.7934638,-0.3628174,0.43064642
colloq_orig,ã¾ã‚ã¡ã‚ƒã‚“ğŸŒ±ã©ã“ã€œï¼Ÿ,Where's your wife?,Mame -chan ğŸŒ± Where?,-0.5806781,-0.18976523,0.3909129
colloq_orig,ãŠã›ãƒ¼ã‚ˆ,"No, no, no, no, no, no, no, no, no, no, no, no, no, no, no, no, no, no.",OK,-0.6612361,-0.27876276,0.38247335
colloq_orig,LLLerã§ã‚ˆãã¿ã‚‹ãƒ¬ã‚¹ãƒãƒ³ã‚¹ã€Œã™ã”ã„ã€ã€Œãˆã‚‰ã„ã€ã€Œã‹ã‚ãˆãˆã€œã€,"""I see a lot of lemurs and lemurs and lemurs and lemurs and lemurs and lemurs and lemurs and lemurs and lemurs and lemurs and lemurs and lemurs and lemurs.""","LLLER's response ""Awesome"" ""great"" ""Kawaie ~""",-0.64018726,-0.28373384,0.35645342
colloq_orig,(Â´ï½¥Ğ´ï½¥`)ã‚„ã ï¼,No!,('ãƒ» Ğ” ãƒ» `) Yeah!,-0.44217607,-0.088276014,0.35390007
colloq_orig,weeklong dealsã‚’ã™ã¹ã¦ãƒã‚§ãƒƒã‚¯ã™ã‚‹ã®ãŒæ¥½ã—ã¿ã ã¨r/steamã§è©±é¡Œã«  ãŸã¾ãƒ¼ã«800ä»¥ä¸Šã®ãŠã‚¹ã‚¹ãƒ¡ãŒè¡¨ç¤ºã•ã‚Œã‚‹ã‚“ã ã‘ã©ã€æ›´æ–°ã—ãŸã‚‰6ã«æˆ»ã‚‹w,We're going to go to the R/S team and we're going to talk about how much fun we're going to have to check all of them out. &gt;&gt;Yeah. &gt;&gt;Yeah. &gt;&gt;Yeah. &gt;&gt;Yeah. &gt;&gt; Yeah. &gt;&gt; Yeah. &gt;&gt; Yeah. &gt;&gt; Yeah. &gt;&gt; Yeah. &gt;&gt; Yeah. &gt;&gt; Yeah. &gt;&gt; Yeah. &gt;&gt; Yeah. &gt;&gt; Yeah. &gt;&gt; Yeah. &gt;&gt;&gt; Yeah. &gt;&gt;&gt; Yeah. &gt;&gt; Yeah. &gt; Yeah. &gt;gt;gt;gt;gt;gt;gt;gt;gt;gt;gt;gt;gt;&gt;gt;&gt;&gt;&gt;&gt;gt;gt;&gt; Yeah.,"If you are looking forward to checking all Weeklong Deals, R/Steam sometimes displays more than 800 recommendations, but if you update it, it will return to 6.",-0.79031044,-0.4423276,0.34798285
colloq_orig,ã¯ãšã‹ã¡ã„...,That's... that's... that's... that's... that's... that's... that's... that's... that's... that's... that's... that's... that's... that's... that's... that's... that's... that's... that's... that's... that's... that's... that's... that's... that's... that's... that's... that's...,It's so bad ...,-0.74409,-0.42662212,0.3174679
